{
  "$schema": "https://json-schema.org/draft/2020-12/schema",
  "$id": "https://agentic-coding-tools.dev/schemas/review-findings.schema.json",
  "title": "Review Findings",
  "type": "object",
  "required": ["review_type", "target", "findings"],
  "properties": {
    "review_type": { "type": "string", "enum": ["plan", "implementation"] },
    "target": { "type": "string", "description": "feature_id for plan review, package_id for implementation review." },
    "reviewer_vendor": { "type": "string" },
    "findings": {
      "type": "array",
      "items": {
        "type": "object",
        "required": ["id", "type", "criticality", "description", "disposition"],
        "properties": {
          "id": { "type": "integer" },
          "type": { "type": "string", "enum": ["spec_gap", "contract_mismatch", "architecture", "security", "performance", "style", "correctness"] },
          "criticality": { "type": "string", "enum": ["low", "medium", "high", "critical"] },
          "description": { "type": "string" },
          "resolution": { "type": "string" },
          "disposition": { "type": "string", "enum": ["fix", "regenerate", "accept", "escalate"] },
          "package_id": { "type": "string" },
          "file_path": { "type": "string", "description": "File path the finding relates to (optional, enables cross-vendor matching)" },
          "line_range": {
            "type": "object",
            "properties": {
              "start": { "type": "integer" },
              "end": { "type": "integer" }
            },
            "description": "Line range within file_path (optional)"
          }
        }
      }
    }
  }
}